448,Waffle Cornmeal,Waffle,Other,264.0,11.38,6.84,33.04,52.0,2.011,480.0,10.0,75.758
449,Waffle Fruit,Waffle,Other,304.0,14.74,6.93,36.24,55.0,3.359,600.0,10.0,65.789
450,Waffle Fruit From Fast Food / Restaurant,Waffle,Other,350.0,20.92,6.59,34.46,52.0,4.138,618.0,10.0,57.143
451,Waffle Fruit From Frozen,Waffle,Other,296.0,9.05,7.07,46.58,12.0,2.172,504.0,10.0,67.568
452,Waffle Plain,Waffle,Other,368.0,18.59,8.69,41.49,70.0,4.274,766.0,10.0,54.348
453,Waffle Plain From Fast Food / Restaurant,Waffle,Other,422.0,26.14,8.15,38.91,66.0,5.199,779.0,10.0,47.393
454,Waffle Plain Reduced Fat,Waffle,Other,338.0,14.41,8.98,42.88,73.0,3.761,792.0,10.0,59.172
455,Waffle Plain Reduced Fat From Frozen,Waffle,Other,289.0,6.96,9.37,46.19,43.0,1.829,511.0,10.0,69.204
456,Waffle Whole Grain,Waffle,Other,360.0,18.98,9.21,38.58,73.0,4.287,855.0,10.0,55.556
457,Waffle Whole Grain From Fast Food / Restaurant,Waffle,Other,416.0,26.73,8.63,36.12,68.0,5.238,863.0,10.0,48.077
458,Waffle Whole Grain From Frozen,Waffle,Other,288.0,8.39,6.78,46.7,0.0,1.362,529.0,10.0,69.444
459,Waffle Whole Grain Fruit From Frozen,Waffle,Other,277.0,8.02,6.48,45.06,0.0,1.3,504.0,10.0,72.202
460,Waffle Whole Grain Reduced Fat,Waffle,Other,329.0,14.69,9.53,39.92,75.0,3.758,885.0,10.0,60.79
